"","Rating","Text"
"572",4,"  Jesus movie theaters are doomed. Well, perhaps not theaters themselves. I'm sure Disney will provide plenty of Marvel, Pixar, and Star Wars movies to keep the lights on. No, I mean moviegoers are doomed. We are going to an age where any serious material, such as arthouse horror or hard science fiction will go to Netflix or other streaming services to die. Some point out that such services could save dying genres such as these, but time will surely tell.In either case, we have another example of hard science fiction failing to connect - Annihilation. Annihilation is the story of an alien ""invasion"" that really isn't an invasion per-se, but an infection. After an alien anomaly lands near the southern US coast and continues to expand, the US government sends teams of soldiers and scientists to access the problem and stop it, if possible. One such all-female team includes our battered protagonist (Natalie Portman) whose husband has inexplicably come home after a year of no contact, devoid of personality and memory. If you think you have heard this story before, you would be correct...to a point. Annihilation takes bits and pieces of the serious science fiction of yesteryear with a dash of cosmic horror. Hence why it feels like a curious, but effective cross of The Andromeda Strain, Solaris, Alien, and Predator. What makes it even more interesting is how the infection is not necessarily hostile, it's merely remaking Earth's environment ""in favor of its new matrix,"" as Mr. Spock would say. Natalie Portman is well known for being selective in her roles in recent years and it would be safe to say that she has gambled correctly. She anchors the picture convincingly and reminds us why Hollywood invested so much in her two decades ago. (Jesus I am getting old.) Jennifer Jason Leigh and Oscar Isaac are great as you'd expect, but I have to nod quite a bit to the other members of the crew (Gina Rodriguez, Tessa Thompson, and Tuva Novotny) for making their mark in what is an essentially a pretty downbeat film. Alex Garland has impressed before with his work on Dredd and Ex Machina, and his commitment to steady shots and earnest story telling outweighs any temptation for cheap visual flair.As for its financial failure, one could possibly attribute it to the very generic and admittedly awful trailer that advertised it. But it goes further than that. The studio, as usual, panicked that audiences would be too stupid to bother with such a movie and planned to dump it on Netflix shortly after its theatrical release - ensuring that much of its potential audience would not pay for something they could soon see at home for free. Perhaps even more glaringly, no attention was paid to its racially diverse, all-female cast. You would think that in our ""woke"" fuck-Trump-and-the-Patriarchy era, Paramount would fall all over themselves in advertising this. But here's the uncomfortable truth. Studio execs know what audiences refuse to admit to themselves - people only pay for schlock or middle-of-the-road entertainment. They want to see people who look like them blow shit up. And while that's perfectly understandable and even justified, (see my Black Panther review) it still means that movies in multiplexes are going to get dumber and dumber. And we can only blame ourselves."
"573",0.5,"  The only advice that i can give To those that wana watch this movie is to just pick a DIFFERENT film... This movie is Trippy as shit and if you wannA be tripping balls aftErwards then go for it! The genre is Labled Thriller and magical, its really just creppy. Also If YOU'RE one of those people That like to get high beFore a moviE or Been WANTING to know how it feels like to be high then pleasEeee watch this movie, i GUARANTEE You 100% that YOU'LL be walking out the theater feeling hIgh ??"
"574",2.5,"  This film has a classic premise, a director with a clear vision of what he wants the film to be, and about 8 minutes of really great practical gore effects. However, the film is bogged down by an extremely deliberate pace that betrays the danger at hand and forces the viewer to apply extreme focus to remain engaged when there's not a ton there to chew on at times. Plus an ending that will leave a lot of mainstream cinema goers who just want to munch popcorn and forget about the flick 10 minutes after its over scratching their heads and wondering what they'd just seen. I would say that this film deserves a least a try from everyone who enjoys sci fi or horror."
"575",1,"  So bad it's insulting. Cable TV quality, at best.-Canned, predictable dialogue-Lazy camera work, Every scene is a green screen-Several Irritating casting choices-Gives no reason for casting no men in main cast-As of the 75 min mark, when I left the theater, there was not one original idea or addition to the genreBasically it's Neil DeGrasse Tyson meets that bad all-female Ghostbusters knockoff. Really makes you wonder how Rotten Tomatoes and critics gave it such a high rating."
"576",5,"  A lowkey masterpiece commenting on the inherent violent tendencies of human nature."
"577",4.5,"  I loved it. Just pay attention and you'll be fine."
"578",1.5,"  Slow moving movie. Boring. Only a few parts that are good. I wanted my money back. Didn't really make sense. That is one movie that should have gone straight to dvd"
"579",5,"  Had my doubts when i saw trailer, but this film is very very good."
"580",5,"  Annihilation is many things. Beautiful. Otherworldly. Unsettling. Terrifying. Bizarre. Any many more. But above all it is brilliant. As horror, action thriller, high concept sci-fi and deeply introspective psychological study it works on every level. It's not a movie for the casual filmgoer, or one that is easy to wrap your head around. But for experienced viewers prepared to have their minds blown, Annihilation is a real treat.The premise is that Natalie Portman is Lena, a biologist who has lost her husband and travels into an area of altered reality called ""the Shimmer"" to learn what happened to him. No one knows to expect when they go in, because only one barely conscious person has ever returned. But nothing could prepare them- or the viewer- for what they find inside.They're on Earth. There are touches of the familiar all around. Abandoned shacks, bayous, alligators. But at the same time the inside of the Shimmer is in many ways a beautiful and alien as Pandora. It's not often you feel compelled to comment on the vegetation in a movie, but the flowers and trees they encounter are simply gorgeous, filling the screen will a whirl of colors completely at odds with the film's tone. The creatures on the other hand are pure nightmare fuel. They're recognizable animals but twisted in horrifying ways that hint at the deeper corruption all around them.Most of the best horror movies work because they stand as a metaphor for our deepest and most common fears. Alien was Rape. The Babadook stood for overwhelming grief. And Annihilation is about guilt, paranoia, and utter mental and emotional breakdown. It's fascinating and more than a little unsettling to watch how each of the main characters slowly become unhinged as they try and fail to come to terms with what they're experiencing. Some display an ever-growing sense of fatalism. Others flat out denial, or overpowering suspicion. In a movie where so much is utterly alien, their breakdowns are surprisingly realistic and nuanced. This could have worked solely as a psychological horror film. But of course the filmmakers weren't content to stop there. There's extremely frightening imagery and bits of gore, used sparingly enough to retain their full impact. The found footage from a previous expedition is literally stomach churning and will probably be too much for many viewers. There are even good jump scares. And oh, how the movie can build suspense. As they go deeper into the Shimmer the tension builds and builds and is held so long as to be almost unbearable. And the ending is simply beyond anything most viewers have ever seen. There are no words to adequately describe it, and to even try would spoil it. Suffice it to say that you will be in a state of utter wonder and bewilderment. There are many things about it I don't understand. But then they're probably not meant to be understood, or even possible to understand. The final act of this movie is Akira level mind-bending. It makes 2001 or Inception look simple and unambiguous. I have my own interpretations of some parts, which I think are what filmmakers intended. But for so many aspects there are no firm answers, only endless possibilities and the questions they create. And that may be the true genius of this movie. For all the terror, the wonder, and the wonderful acting, perhaps what Annihilation succeeds at the most is how much it will make you think."
"581",4.5,"  it didn't have a superhero in it, that's good enough for me."
"582",4.5,"  One of the strangest, most perplexing sci-fi films I've seen in a while. Definitely worth a second and third watch to untangle the puzzle of this unapologetically weird little film."
"583",4,"  Alex Garland's ""Annihilation"" is a unique, puzzling, and visually stunning work of science fiction. I found the movie to be interesting the whole way through and think it is a well-made movie. Visually the movie is both beautiful at times and horrifying in others, but all of it is effective. I do feel for the most part the movie builds tension and maintains an eerie atmosphere that kept me on the edge of my seat. However, there still are segments that felt uneventful and slow,†but even during these moments, you are treated to some impressive visuals. Natalie Portman does a good job in the lead role and her character carries the movie. There is a subplot in the movie that I felt doesn't really fit or contribute to the rest of it, but I wouldn't be surprised if I was just missing something. I did not see the final act of this movie coming and I feel that is where audiences will be most divided. I enjoyed the last act of the movie but I am still trying to fully understand what exactly happened. The ambiguous¬†nature of the film leaves plenty of room for discussions to be had. The film certainly isn't for mainstream audiences, but if you're a fan of movies that'll leave you scratching your head and leaving you wanting to know more, this one is worth checking out."
"584",3.5,"  THis movie is Definitely worth a watch. However, the acting bothered me throughout. Oscar Isaac acted like he was on drugs in most of his scenes, which I suppose was as intended, but made his performance very boring. Portman was the same character she always plays. Very flat, little emotion, unrelatable. Jennifer Jason Leigh was trying to channel some weird sadistic ""look at me I'm so unhinged and don't care about anything"" performance. Like Isaac's performance, I understand WHY you would go that direction, but with this actress, it just came off as weird and made me disconnected from the film. Overall, I feel like the film could have been cut down by 10-15 minutes, mostly because of the glacial acting, and would have been a lot better for it.Aside from the performances, the visuals were amazing and the story was unique. This will definitely become a cult classic in the future. For me, one viewing was enough, but I'm glad I saw it.?"
"585",5,"  sci-fi horror that sticks with you. doesn't hold the audience's hand - conjures a real sense of dread. great movie, but a shame no one will see it."
"586",5,"  brilliantly layered themes. it'll make you think for hours after it ends. if you don't like thinking, watch it anyway."
"587",5,"  WOw went into this movie not knowing what to expect, came out blown away"
"588",4.5,"  8.9/10. Great flick. Cinematography was dope. The confusion, crazy storyline, and theories is what makes it so good. I look forward to the next movie. Would watch again just to pick up the small details."
"589",4.5,"  An amazing sci-fi film that doesn't hold your hand."
"590",1,"  ConfuSing and muttles. Thought this was one of tHe worst movies ive ever seen in my life. My brain hurts fromThis. It felt like i took acid before seeing it."
"591",5,"  As of February 23rd 2018, there are now two movies that genuinely scare me. Pans Labyrinth and Annihilation. The concept of 'the shimmer' presented a terrifying nightmare fueled by science and the unknown and in all honesty, I've never had sweaty palms for so long. The antagonist was refreshingly alien, the lack of intention and confusion presenting a childlike force of rebirth. Though the film could have stood on its two legs with gorgeous visuals alone, every scene was highlighted by an amazing score and sound design. This movie was clearly written for cinema, as I felt utterly encapsulated by noise. Every note demanded my attention. On the surface, its one of my favourite horror movies - and that's what I thought as I walked out of the theatre. But Annihilation isn't a film that you forget about on the drive home. Or as you lay awake in bed trying not to think about screaming bears (How DARE you, Alex Garland). It demands a closer look and as you pick it apart piece by piece, each element shines under examination. Horror film, trippy science fiction, cerebral film about self destruction; there's something for everyone."
"592",2,"  Good visuals, strange plot that's almost embarrassed to embrace its potential. Only scratched the surface of character development.... But the entire movie is a close up of characters. Frustrating."
"593",1,"  The audience score is alot closer to What this dreary film deserves. The critics are praising what? Characters we dont care to follow ?A Script with meaningless dialog?The whole Geneitic angle that missing forwarding any intersting ideas to ponder Relating to humans tickering. Sonething Garland achieved beautifuly in ex mechina. If this juSt a aCtion film such as predator, it does not engage as a survivAl story."
"594",0.5,"  Ok. I will keep it simple. I LOVE complex, confusing movies. Loved the directors other movie. This movie however, is probably the worst movie I have ever seen in my entire life. I am not sure where or how any decent ratings are coming from. Everyone in the theater also was baffled, confused, laughing at the film (not the funny parts) and disoriented. The film had no purpose, an resolved nothing. It was complete garbage and the ending was so predictable. Again, I repeat. This is by far, the worst movie I have ever seen. I cannot think of another movie that was worse than this. I think people feel they ""have"" to like it, or that it is more complex than it is. To not like it would mean they are stupid. But don't be tricked or lie to yourself. This is the worst movie ever made (on a hollywood/higher budget scale)Terrible and without purpose or resolution.."
"595",5,"  This movie is just flat awesome. Go see it."
"596",5,"  An original and engaging story, well executed in every way. If you are sick of everything being either a remake or a sequel then do yourself, and everyone else who feels the same, a favor and support this film!"
"597",1.5,"  vERY PRETTY, AND MAKES NO SENSE. fLAWED PREMISE (APPLYING A BIOLOGICAL IDEA TO THINGS THAT NEVER CHANGE)."
"598",5,"  This movie is not for everyone, but if yOu are an imaginative, creative, curious person who enjoys things that are different and ""out there"" then you will likely atleast somewhat enjoy this moVie, and many of you will Absolutely be blown away by it. Reading the negative reviews That have been wRitten for this movie should tell you everthing yOu need to know About the type of pEople who disliked It. Many Of them have Forgotten that not Everyone has to like what they like, and Hate what they hate. People can have different Opinions."
"599",4,"  This was an awesome dark sci fi film. Intelligent, though provoking and all around enjoyable. Why is no one talking about it? Are people that addicted to dumb that a smart film is always released quietly by Hollywood these days?"
"600",4,"  It starts off really interesting and makes you feel like a lot is going to haPpen, in more of an action movie sort of way but then really changes gears to a relatable sCience fiction film. I might go see it again tonight."
"601",3,"  Well... So this is about a supernatural disaster area. It is slowly expanding, and there is very limited knowledge about what exactly is inside of it, given that everyone who has ever entered has failed to return. A biologist (Natalie Portman) volunteers to join a team of ladies as they are the next up to brave the unknown. Now I was actually pretty pumped for this because this is Alex Garland's follow up to the terrific Ex Machina, a movie that I hold dear to my heart. He seems to have a passion for science fiction, so I am going to make a point of following his career moving forward. With Annihilation, there are definitely moments that satiated me throughout, but I was unfortunately left feeling more underwhelmed than I had hoped to be. Now I tried my hardest to get with this. I was able to take the slow pacing, and to be honest, it didn't even bother me all that much, as it felt like it was a deliberate choice made by the director. I like that this cast is almost entirely female, and if there is a movie that passes the Bechdel test, it is this one here. I like all of the science-fiction touches, and Alex Garland isn't exactly a lightweight in that department. He gets some really quality camerawork in with some gorgeous imagery in this surreal dimension. It is really a mystery at heart, and I dug not knowing exactly where it was going, and this is a story that never over-explains, so you are always interested... but as you can probably guess, I am about to drop that other shoe. I have given a lot of thought to this, and I think my biggest problems with this stem around the ending. This puts me in a tough spot as a reviewer, because I never want to be the one to spoil a story for you. What I will do is split the difference and say this: I didn't like the ending to this because I spent so much time investing myself into this story, and for it to wind up being something that is so trite just turned me off. It kind of cheapens all the nice touches that I had previously enjoyed so much, and I feel that there is a pretty good chance that you will walk away from this with a sour taste in your mouth. I also don't think it is as deep as Ex Machina, but hey, this may all just be me. I strongly encourage you to make up your own mind for yourself on this."
"602",5,"  Most interesting original sci-fi horror drama in a long time. left the theater thinking. also all female cast where the actress/characters are treated and writen like real people. I enjoyed it, and it lingered with me long after i watched it."
"603",0.5,"  I walked out about halfway through. I never really could understand any of it. fair warning ;)"
"604",4,"  Suspenseful, intriguing, and a breath of fresh air, Annihilation proves that Alex Garland's Ex-Machina success was not a fluke. Natalie Portman shines as biologist/professor Lena, a character who has nothing to lose and is therefore free from the fear of death that affects the average person. Portman plays Lena with a curious intellect, believable traumatization, and a cold aloofness; there isn't really any reason to like her character, and yet you still find yourself rooting for her to succeed. Jennifer Jason Leigh plays an even quieter and more remote/emotionally hidden psychologist, delivering some of the starkest yet most thought-provoking lines. Tessa Thompson plays a shy physicist, Gina Rodriguez plays a cynical paramedic with some humor, Tuva Novotny plays a geologist, and Oscar Isaac plays Portman's husband, Kane, who is always not saying something. A simple criticism that can be made about Annihilation is its lack of character development. There is a familiar pattern of one by one they all get picked off until there is one left, and no matter how grippingly the movie does that, the overall lack of any investment or development of a character outside Lena cannot be overlooked. We learn a bit about Jennifer Jason Leigh's character, but little about anyone else. The rest of the crew is portrayed as having personal reasons for going on what is essentially a suicide mission, but this is barely explored. The second half of Annihilation quickly becomes the Natalie Portman show when it really doesn't need to be. However, Annihilation is a mind-bending and sometimes challenging film with a little bit of everything for each type of audience member. The visual effects are grandiose, the movie is full of psychedelic imagery that looks like it came from Wonderland; the only criticism I have of the film's visuals is its incessant calls for lens flares, which cheapened too many shots that didn't need them. There are horror elements as well in the film. These are not too scary for those easily frightened, but several scenes are extremely tense and some images will stick with you beyond the theater. The dialogue, while not as interesting or provocative as in Ex-Machina, is still sharply written and thought-provoking. The score does an excellent job at setting the atmosphere within the shimmer; it helps you feel the danger in certain scenes more intensely and the nerve-racking ending in particular is heightened by it. Speaking of the ending, I feel this is where audiences will be divided. The last 20 minutes or so take the film to a whole new level, the craziness and wow factor of the whole thing multiplies. While watching I wanted to know what was going on, but I was too busy screaming in my head ""What is happening!?"" I realized later there wasn't much to analyze and the last shot of the film wasn't hard to see coming either. I believe the whole sequence was meant to represent the movie's central theme of self-destruction, but it could have been more. I'm not disappointed with how Annihilation ended, but I can't say I was fully satisfied either. When a movie has such a great build-up and you become engrossed in the plot, curious to see what the characters discover next about the shimmer and what's inside it, it can become difficult to keep the wheels tightly fastened to the vehicle when racing to the end.Annihilation is a good sci-fi film with some staggering imagery. It captivated me, had me on the edge of my seat, and left me wanting more. But its conclusion, coupled with its shallow supporting characters, kept Annihilation from reaching the level of great sci-fi (cough...cough...Blade Runner 2049)."
"605",5,"  This movie is fantastic slow-burn 70s-style sci-fi horror. I guarantee that you'll be still thinking and talking about it for days after seeing it."
"606",2,"  This movie was a bad version of Predator. I almost walked out 1/2 hour before it ended, due to a crazy storyline and overacting. D+"
"607",4,"  A fun and imaginative movie with some creepy scenes that will make you uncomfortable. The relationship between natalie portman's character and her husband unfolds throughout the movie and provides a unexpected twist. This movie gives you plenty to think about after you leave the theater which Is a good measure if it was worth watching or not. it also has great visuals including some cool and frightening mutated animals and plants. maybe the freshest sci-fi that I've seen in a while. a nice escape."
"608",3,"  I didn't understand Ex Machina, but some podcasters I like enjoyed the movie ( rather saw merit in the movie) so I thought I'd give it a try. It starts off slow, but is well acted. There's not a lot of action so my attention wandered a bit. It is intriguing that it's an all women team. That was an appeal for me too. But it is a weird movie. It's just very weird. At the end I was like, ""Okay. Enough of this."" I was glad to be done. I must say, though, and it must be emphasized, Natalie Portman is a badass in this movie! I was like, ""Whoa! Was she in the Israeli army or what?"" She doesn't mess around. She really should be doing action pictures. If she want itty-bitty she probably would. But she walks like , ""Hey I'm not playing!"" And she carries herself with such power. Just.... whoa! Yeah Natalie Portman rocked this part."
"609",1,"  Save your money and your time. OMG, I'll never see a Nat port movie agian w/o reading reviews. 87%??? WTF??? Worst movie of the last five years."
"610",4,"  A great film that makes you think. Sadly, these films are fewer and far between. catch it in theaters before it's gone."
"611",3.5,"  such a strange movie... even stranger than the book. Some really interesting things going on, and some amazing visuals, but it really started to drag in the middle. 3.5/5"
"612",3.5,"  To describe what the movie 'ANNIHILATION' is in one sentence or more is pretty difficult to do. With that said, if you enjoy watching engaging Sci-fi materials, such as black mirror or twilight zone, I think you'll have good time watching this. The actings are pretty good, visual effects are pretty cool for small Sci-fi movie and good production values overall. The only flaw of the movie will be its high concept and theme that is in the movie, because most people won't understand or want to understand what they have just watched (or experienced) thus leaving the audiences with negative reviews, for lack of better words. At the end of the day, I do hope people will check it out...??"
"613",4,"  Weird, creepy, Good! Interesting story. Sorry for the all caps. Can't turn off."
"614",4.5,"  Liked it, chased a few rabbits that didn't make since and sadly had to add a bunch of F words in the middle for no reason."
